{"schema_version":"1.0","id":"cbt-cards-content-review-v1","name":"CBT Cards content review registry","canonical":"https://cbt-cards.github.io/data/content-review.json","updated":"2026-08-18","policy":{"covered_catalog_resource_types":["learning","worksheet","toolkit-card"],"include_owned_practices":true,"review_kind":"editorial_source_and_safety","target_interval_days":365,"overdue_behavior":"CI blocks deployment until the affected content is reviewed and its review metadata is updated.","clinical_validation_status":"not_claimed","scope_note":"Review checks source/provenance, public wording, evidence links where present, safety boundaries, publication state, and page/data consistency. It is not clinical validation, efficacy evidence, diagnosis, or individualized treatment review."},"summary":{"covered_items":26,"catalog_resources":15,"owned_practices":11,"next_due":"2027-08-18"},"items":[{"id":"cbt-thought-record","kind":"catalog_resource","content_type":"learning","canonical_url":"https://cbt-cards.github.io/learn/cbt-thought-record/","status":"reviewed","last_reviewed":"2026-08-18","next_review_due":"2027-08-18","review_scope":"editorial_source_and_safety","reviewed_by":"CBT Cards project","clinical_validation_status":"not_claimed"},{"id":"automatic-thoughts","kind":"catalog_resource","content_type":"learning","canonical_url":"https://cbt-cards.github.io/learn/automatic-thoughts/","status":"reviewed","last_reviewed":"2026-08-18","next_review_due":"2027-08-18","review_scope":"editorial_source_and_safety","reviewed_by":"CBT Cards project","clinical_validation_status":"not_claimed"},{"id":"thought-vs-fact","kind":"catalog_resource","content_type":"learning","canonical_url":"https://cbt-cards.github.io/learn/thought-vs-fact/","status":"reviewed","last_reviewed":"2026-08-18","next_review_due":"2027-08-18","review_scope":"editorial_source_and_safety","reviewed_by":"CBT Cards project","clinical_validation_status":"not_claimed"},{"id":"worry-time","kind":"catalog_resource","content_type":"learning","canonical_url":"https://cbt-cards.github.io/learn/worry-time/","status":"reviewed","last_reviewed":"2026-08-18","next_review_due":"2027-08-18","review_scope":"editorial_source_and_safety","reviewed_by":"CBT Cards project","clinical_validation_status":"not_claimed"},{"id":"activity-planning","kind":"catalog_resource","content_type":"learning","canonical_url":"https://cbt-cards.github.io/learn/activity-planning/","status":"reviewed","last_reviewed":"2026-08-18","next_review_due":"2027-08-18","review_scope":"editorial_source_and_safety","reviewed_by":"CBT Cards project","clinical_validation_status":"not_claimed"},{"id":"cbt-journaling","kind":"catalog_resource","content_type":"learning","canonical_url":"https://cbt-cards.github.io/learn/cbt-journaling/","status":"reviewed","last_reviewed":"2026-08-18","next_review_due":"2027-08-18","review_scope":"editorial_source_and_safety","reviewed_by":"CBT Cards project","clinical_validation_status":"not_claimed"},{"id":"cbt-thought-record-7-step","kind":"catalog_resource","content_type":"worksheet","canonical_url":"https://cbt-cards.github.io/worksheets/cbt-thought-record/","status":"reviewed","last_reviewed":"2026-08-18","next_review_due":"2027-08-18","review_scope":"editorial_source_and_safety","reviewed_by":"CBT Cards project","clinical_validation_status":"not_claimed"},{"id":"worry-time-6-step","kind":"catalog_resource","content_type":"worksheet","canonical_url":"https://cbt-cards.github.io/worksheets/worry-time/","status":"reviewed","last_reviewed":"2026-08-18","next_review_due":"2027-08-18","review_scope":"editorial_source_and_safety","reviewed_by":"CBT Cards project","clinical_validation_status":"not_claimed"},{"id":"activity-planning-7-step","kind":"catalog_resource","content_type":"worksheet","canonical_url":"https://cbt-cards.github.io/worksheets/activity-planning/","status":"reviewed","last_reviewed":"2026-08-18","next_review_due":"2027-08-18","review_scope":"editorial_source_and_safety","reviewed_by":"CBT Cards project","clinical_validation_status":"not_claimed"},{"id":"source-card-4","kind":"catalog_resource","content_type":"toolkit-card","canonical_url":"https://cbt-cards.github.io/toolkit/cards/challenge-your-thoughts/","status":"reviewed","last_reviewed":"2026-08-18","next_review_due":"2027-08-18","review_scope":"editorial_source_and_safety","reviewed_by":"CBT Cards project","clinical_validation_status":"not_claimed"},{"id":"source-card-15","kind":"catalog_resource","content_type":"toolkit-card","canonical_url":"https://cbt-cards.github.io/toolkit/cards/worry-box/","status":"reviewed","last_reviewed":"2026-08-18","next_review_due":"2027-08-18","review_scope":"editorial_source_and_safety","reviewed_by":"CBT Cards project","clinical_validation_status":"not_claimed"},{"id":"source-card-16","kind":"catalog_resource","content_type":"toolkit-card","canonical_url":"https://cbt-cards.github.io/toolkit/cards/big-goals-small-steps/","status":"reviewed","last_reviewed":"2026-08-18","next_review_due":"2027-08-18","review_scope":"editorial_source_and_safety","reviewed_by":"CBT Cards project","clinical_validation_status":"not_claimed"},{"id":"source-card-21","kind":"catalog_resource","content_type":"toolkit-card","canonical_url":"https://cbt-cards.github.io/toolkit/cards/thoughts-are-not-facts/","status":"reviewed","last_reviewed":"2026-08-18","next_review_due":"2027-08-18","review_scope":"editorial_source_and_safety","reviewed_by":"CBT Cards project","clinical_validation_status":"not_claimed"},{"id":"source-card-27","kind":"catalog_resource","content_type":"toolkit-card","canonical_url":"https://cbt-cards.github.io/toolkit/cards/socratic-questioning/","status":"reviewed","last_reviewed":"2026-08-18","next_review_due":"2027-08-18","review_scope":"editorial_source_and_safety","reviewed_by":"CBT Cards project","clinical_validation_status":"not_claimed"},{"id":"source-card-32","kind":"catalog_resource","content_type":"toolkit-card","canonical_url":"https://cbt-cards.github.io/toolkit/cards/ground-yourself/","status":"reviewed","last_reviewed":"2026-08-18","next_review_due":"2027-08-18","review_scope":"editorial_source_and_safety","reviewed_by":"CBT Cards project","clinical_validation_status":"not_claimed"},{"id":"practice-test-your-prediction","kind":"owned_practice","content_type":"practice","canonical_url":"https://cbt-cards.github.io/practice/#practice-test-your-prediction","status":"reviewed","last_reviewed":"2026-08-18","next_review_due":"2027-08-18","review_scope":"editorial_source_and_safety","reviewed_by":"CBT Cards project","clinical_validation_status":"not_claimed"},{"id":"practice-problem-or-worry","kind":"owned_practice","content_type":"practice","canonical_url":"https://cbt-cards.github.io/practice/#practice-problem-or-worry","status":"reviewed","last_reviewed":"2026-08-18","next_review_due":"2027-08-18","review_scope":"editorial_source_and_safety","reviewed_by":"CBT Cards project","clinical_validation_status":"not_claimed"},{"id":"practice-spot-the-safety-behavior","kind":"owned_practice","content_type":"practice","canonical_url":"https://cbt-cards.github.io/practice/#practice-spot-the-safety-behavior","status":"reviewed","last_reviewed":"2026-08-18","next_review_due":"2027-08-18","review_scope":"editorial_source_and_safety","reviewed_by":"CBT Cards project","clinical_validation_status":"not_claimed"},{"id":"practice-park-and-return","kind":"owned_practice","content_type":"practice","canonical_url":"https://cbt-cards.github.io/practice/#practice-park-and-return","status":"reviewed","last_reviewed":"2026-08-18","next_review_due":"2027-08-18","review_scope":"editorial_source_and_safety","reviewed_by":"CBT Cards project","clinical_validation_status":"not_claimed"},{"id":"practice-reflection-or-replay","kind":"owned_practice","content_type":"practice","canonical_url":"https://cbt-cards.github.io/practice/#practice-reflection-or-replay","status":"reviewed","last_reviewed":"2026-08-18","next_review_due":"2027-08-18","review_scope":"editorial_source_and_safety","reviewed_by":"CBT Cards project","clinical_validation_status":"not_claimed"},{"id":"practice-one-less-check","kind":"owned_practice","content_type":"practice","canonical_url":"https://cbt-cards.github.io/practice/#practice-one-less-check","status":"reviewed","last_reviewed":"2026-08-18","next_review_due":"2027-08-18","review_scope":"editorial_source_and_safety","reviewed_by":"CBT Cards project","clinical_validation_status":"not_claimed"},{"id":"practice-smallest-approach-step","kind":"owned_practice","content_type":"practice","canonical_url":"https://cbt-cards.github.io/practice/#practice-smallest-approach-step","status":"reviewed","last_reviewed":"2026-08-18","next_review_due":"2027-08-18","review_scope":"editorial_source_and_safety","reviewed_by":"CBT Cards project","clinical_validation_status":"not_claimed"},{"id":"practice-good-enough-contract","kind":"owned_practice","content_type":"practice","canonical_url":"https://cbt-cards.github.io/practice/#practice-good-enough-contract","status":"reviewed","last_reviewed":"2026-08-18","next_review_due":"2027-08-18","review_scope":"editorial_source_and_safety","reviewed_by":"CBT Cards project","clinical_validation_status":"not_claimed"},{"id":"practice-continuum-not-verdict","kind":"owned_practice","content_type":"practice","canonical_url":"https://cbt-cards.github.io/practice/#practice-continuum-not-verdict","status":"reviewed","last_reviewed":"2026-08-18","next_review_due":"2027-08-18","review_scope":"editorial_source_and_safety","reviewed_by":"CBT Cards project","clinical_validation_status":"not_claimed"},{"id":"practice-behavior-not-identity","kind":"owned_practice","content_type":"practice","canonical_url":"https://cbt-cards.github.io/practice/#practice-behavior-not-identity","status":"reviewed","last_reviewed":"2026-08-18","next_review_due":"2027-08-18","review_scope":"editorial_source_and_safety","reviewed_by":"CBT Cards project","clinical_validation_status":"not_clai